A1: Monster 2004 It's Hot
A2: Place | B2: Flight | C2: Team | D2: Day 1 | E2: Day 2 | F2: Total
A3: 1 | B3: 2 - Blue | C3: 02 - Benson, Mike / Pesicka, Jay | D3: 47 | E3: 73 | F3: =SUM(D3:E3) -> 120
A4: 2 | B4: 1 - Red | C4: 08 - Plemel, Paul / Wald, Doug | D4: 48 | E4: 70 | F4: =SUM(D4:E4) -> 118
A5: 3 | B5: 2 - Blue | C5: 06 - Foltz, Ryan / Raymo, Chad | D5: 43 | E5: 74 | F5: =SUM(D5:E5) -> 117
A6: 4 | B6: 3 - Orange | C6: 30 - Loftis, Alan / Canfield, Mike | D6: 43 | E6: 74 | F6: =SUM(D6:E6) -> 117
A7: 5 | B7: 2 - Blue | C7: 32 - Evenson, Pat / Redfern, Kirk | D7: 48 | E7: 65 | F7: =SUM(D7:E7) -> 113
A8: 6 | B8: 2 - Blue | C8: 05 - Carlson, Randy / Stork, Mike | D8: 43 | E8: 70 | F8: =SUM(D8:E8) -> 113
A9: 7 | B9: 2 - Blue | C9: 16 - Pederson, Lance / Wald, Aaron | D9: 48 | E9: 64 | F9: =SUM(D9:E9) -> 112
A10: 8 | B10: 3 - Orange | C10: 17 - Lorimor, Adrienne / Lorimor, Alden | D10: 44 | E10: 65 | F10: =SUM(D10:E10) -> 109
A11: 9 | B11: 1 - Red | C11: 01 - Anderson, Scott / Haseleu, Jeff | D11: 42 | E11: 67 | F11: =SUM(D11:E11) -> 109
A12: 10 | B12: 1 - Red | C12: 03 - Clark, Jim / Levitt, Mike | D12: 40 | E12: 69 | F12: =SUM(D12:E12) -> 109
A13: 11 | B13: 3 - Orange | C13: 11 - Young, Ken / Slezak, Dave | D13: 45 | E13: 62 | F13: =SUM(D13:E13) -> 107
A14: 12 | B14: 2 - Blue | C14: 29 - Hanson, Scott / Vandyke, Joel | D14: 45 | E14: 62 | F14: =SUM(D14:E14) -> 107
A15: 13 | B15: 1 - Red | C15: 15 - Bartsch, Jason / Krogstad, Brad | D15: 44 | E15: 63 | F15: =SUM(D15:E15) -> 107
A16: 14 | B16: 3 - Orange | C16: 22 - Proszek, Danette / Macintyre, Shamus | D16: 37 | E16: 70 | F16: =SUM(D16:E16) -> 107
A17: 15 | B17: 3 - Orange | C17: 13 - Becker, Rick / Stork, Dave | D17: 46 | E17: 60 | F17: =SUM(D17:E17) -> 106
A18: 16 | B18: 2 - Blue | C18: 27 - Lavin, Jim / Johnson, Rob | D18: 41 | E18: 65 | F18: =SUM(D18:E18) -> 106
A19: 17 | B19: 3 - Orange | C19: 09 - Podolak, Colette / Boreson, Debbie | D19: 41 | E19: 64 | F19: =SUM(D19:E19) -> 105
A20: 18 | B20: 1 - Red | C20: 18 - Farrell, Brett / Tufto, Scott | D20: 40 | E20: 65 | F20: =SUM(D20:E20) -> 105
A21: 19 | B21: 3 - Orange | C21: 26 - Stork, Barb / Muzzy, Jeff | D21: 40 | E21: 63 | F21: =SUM(D21:E21) -> 103
A22: 20 | B22: 1 - Red | C22: 07 - Lavin, Dick / McCann, Tom | D22: 40 | E22: 60 | F22: =SUM(D22:E22) -> 100
A23: 21 | B23: 1 - Red | C23: 21 - Baldschun, Gary / Decker, Ron | D23: 38 | E23: 61 | F23: =SUM(D23:E23) -> 99
A24: 22 | B24: 1 - Red | C24: 24 - Bass, Don / Francis, Steve | D24: 33 | E24: 66 | F24: =SUM(D24:E24) -> 99
A25: 23 | B25: 2 - Blue | C25: 31 - Eldridge, Bart / Podolak, Wayne | D25: 35 | E25: 63 | F25: =SUM(D25:E25) -> 98
A26: 24 | B26: 1 - Red | C26: 04 - Boreson, Mike / Podolak, Rich | D26: 36 | E26: 60 | F26: =SUM(D26:E26) -> 96
A27: 25 | B27: 3 - Orange | C27: 14 - Wald, Patti / Wallace, Beth | D27: 43 | E27: 52 | F27: =SUM(D27:E27) -> 95
A28: 26 | B28: 2 - Blue | C28: 12 - Holmquist, Paul / Sahli, Dave | D28: 46 | E28: 48 | F28: =SUM(D28:E28) -> 94
A29: 27 | B29: 2 - Blue | C29: 20 - Wald, Dewey / Beitner, Paul | D29: 39 | E29: 55 | F29: =SUM(D29:E29) -> 94
A30: 28 | B30: 1 - Red | C30: 25 - Hefta, Neil / Grondahl, Troy | D30: 37 | E30: 54 | F30: =SUM(D30:E30) -> 91
A31: 29 | B31: 2 - Blue | C31: 23 - Proszek, Tom / Proszek, Darin | D31: 42 | E31: 48 | F31: =SUM(D31:E31) -> 90
A32: 30 | B32: 3 - Orange | C32: 10 - Donaldson, Brian / Peterson, Grant | D32: 36 | E32: 51 | F32: =SUM(D32:E32) -> 87
A33: 31 | B33: 1 - Red | C33: 28 - Wald, Jeff / Whalen, Thad | D33: 27 | E33: 54 | F33: =SUM(D33:E33) -> 81
A34: 32 | B34: 2 - Blue | C34: 19 - Lorenz, Brian / Ness, Andy | D34: 33 | E34: 45 | F34: =SUM(D34:E34) -> 78